{
  "schema_version": 1,
  "device_id": "classroom-001-node-001",
  "room_id": "classroom-001",
  "boot_id": "7c9a21f0",
  "seq": 1,
  "sampled_at": "2026-10-16T02:00:00.000Z",
  "source": "simulator",
  "metrics": {
    "temperature_c": 24.6,
    "humidity_rh": 48.2,
    "co2_ppm": 720,
    "dust_ug_m3": 28,
    "illuminance_lux": 430
  }
}
